{
  "$schema": "https://json-schema.org/draft/2020-12/schema",
  "$id": "knowledge/reference/avr/atmega2560/registers.json",
  "platform": "arduino",
  "mcu": "ATmega2560",
  "mcu_series": "avr",
  "version": "2.0.0",
  "source": "ATmega2560 datasheet (Microchip DS40002591B)",
  "description": "ATmega2560 complete register map — all 11 ports, 6 timers, 4 USARTs, SPI, TWI, ADC",
  "license": "Fair use - datasheet reference data",
  "register_groups": {
    "gpio": {
      "description": "General Purpose I/O — 11 ports (A-L, no port I)",
      "registers": [
        {
          "name": "PINA",
          "address": "0x20",
          "size": 8,
          "description": "Port A Input Pins"
        },
        {
          "name": "DDRA",
          "address": "0x21",
          "size": 8,
          "description": "Port A Data Direction"
        },
        {
          "name": "PORTA",
          "address": "0x22",
          "size": 8,
          "description": "Port A Data"
        },
        {
          "name": "PINB",
          "address": "0x23",
          "size": 8,
          "description": "Port B Input Pins"
        },
        {
          "name": "DDRB",
          "address": "0x24",
          "size": 8,
          "description": "Port B Data Direction"
        },
        {
          "name": "PORTB",
          "address": "0x25",
          "size": 8,
          "description": "Port B Data"
        },
        {
          "name": "PINC",
          "address": "0x26",
          "size": 8,
          "description": "Port C Input Pins"
        },
        {
          "name": "DDRC",
          "address": "0x27",
          "size": 8,
          "description": "Port C Data Direction"
        },
        {
          "name": "PORTC",
          "address": "0x28",
          "size": 8,
          "description": "Port C Data"
        },
        {
          "name": "PIND",
          "address": "0x29",
          "size": 8,
          "description": "Port D Input Pins"
        },
        {
          "name": "DDRD",
          "address": "0x2A",
          "size": 8,
          "description": "Port D Data Direction"
        },
        {
          "name": "PORTD",
          "address": "0x2B",
          "size": 8,
          "description": "Port D Data"
        },
        {
          "name": "PINE",
          "address": "0x2C",
          "size": 8,
          "description": "Port E Input Pins"
        },
        {
          "name": "DDRE",
          "address": "0x2D",
          "size": 8,
          "description": "Port E Data Direction"
        },
        {
          "name": "PORTE",
          "address": "0x2E",
          "size": 8,
          "description": "Port E Data"
        },
        {
          "name": "PINF",
          "address": "0x2F",
          "size": 8,
          "description": "Port F Input Pins"
        },
        {
          "name": "DDRF",
          "address": "0x30",
          "size": 8,
          "description": "Port F Data Direction"
        },
        {
          "name": "PORTF",
          "address": "0x31",
          "size": 8,
          "description": "Port F Data"
        },
        {
          "name": "PING",
          "address": "0x32",
          "size": 8,
          "description": "Port G Input Pins"
        },
        {
          "name": "DDRG",
          "address": "0x33",
          "size": 8,
          "description": "Port G Data Direction"
        },
        {
          "name": "PORTG",
          "address": "0x34",
          "size": 8,
          "description": "Port G Data"
        },
        {
          "name": "PINH",
          "address": "0x35",
          "size": 8,
          "description": "Port H Input Pins"
        },
        {
          "name": "DDRH",
          "address": "0x36",
          "size": 8,
          "description": "Port H Data Direction"
        },
        {
          "name": "PORTH",
          "address": "0x37",
          "size": 8,
          "description": "Port H Data"
        },
        {
          "name": "PINJ",
          "address": "0x3B",
          "size": 8,
          "description": "Port J Input Pins"
        },
        {
          "name": "DDRJ",
          "address": "0x3C",
          "size": 8,
          "description": "Port J Data Direction"
        },
        {
          "name": "PORTJ",
          "address": "0x3D",
          "size": 8,
          "description": "Port J Data"
        },
        {
          "name": "PINK",
          "address": "0x3E",
          "size": 8,
          "description": "Port K Input Pins"
        },
        {
          "name": "DDRK",
          "address": "0x3F",
          "size": 8,
          "description": "Port K Data Direction"
        },
        {
          "name": "PORTK",
          "address": "0x40",
          "size": 8,
          "description": "Port K Data"
        },
        {
          "name": "PINL",
          "address": "0x41",
          "size": 8,
          "description": "Port L Input Pins"
        },
        {
          "name": "DDRL",
          "address": "0x42",
          "size": 8,
          "description": "Port L Data Direction"
        },
        {
          "name": "PORTL",
          "address": "0x43",
          "size": 8,
          "description": "Port L Data"
        }
      ]
    },
    "tc0": {
      "description": "Timer/Counter0 — 8-bit",
      "registers": [
        {
          "name": "TCCR0A",
          "address": "0x44",
          "size": 8,
          "description": "TC0 Control Register A",
          "fields": [
            {
              "name": "WGM00",
              "bit": 0,
              "access": "rw",
              "reset": 0,
              "description": "Waveform Generation Mode bit 0"
            },
            {
              "name": "WGM01",
              "bit": 1,
              "access": "rw",
              "reset": 0,
              "description": "Waveform Generation Mode bit 1"
            },
            {
              "name": "COM0B0",
              "bit": 4,
              "access": "rw",
              "reset": 0,
              "description": "Compare Output Mode B bit 0"
            },
            {
              "name": "COM0B1",
              "bit": 5,
              "access": "rw",
              "reset": 0,
              "description": "Compare Output Mode B bit 1"
            },
            {
              "name": "COM0A0",
              "bit": 6,
              "access": "rw",
              "reset": 0,
              "description": "Compare Output Mode A bit 0"
            },
            {
              "name": "COM0A1",
              "bit": 7,
              "access": "rw",
              "reset": 0,
              "description": "Compare Output Mode A bit 1"
            }
          ]
        },
        {
          "name": "TCCR0B",
          "address": "0x45",
          "size": 8,
          "description": "TC0 Control Register B",
          "fields": [
            {
              "name": "CS00",
              "bit": 0,
              "access": "rw",
              "reset": 0,
              "description": "Clock Select bit 0"
            },
            {
              "name": "CS01",
              "bit": 1,
              "access": "rw",
              "reset": 0,
              "description": "Clock Select bit 1"
            },
            {
              "name": "CS02",
              "bit": 2,
              "access": "rw",
              "reset": 0,
              "description": "Clock Select bit 2"
            },
            {
              "name": "WGM02",
              "bit": 3,
              "access": "rw",
              "reset": 0,
              "description": "Waveform Generation Mode bit 2"
            },
            {
              "name": "FOC0B",
              "bit": 6,
              "access": "rw",
              "reset": 0,
              "description": "Force Output Compare B"
            },
            {
              "name": "FOC0A",
              "bit": 7,
              "access": "rw",
              "reset": 0,
              "description": "Force Output Compare A"
            }
          ]
        },
        {
          "name": "TCNT0",
          "address": "0x46",
          "size": 8,
          "description": "TC0 Counter"
        },
        {
          "name": "OCR0A",
          "address": "0x47",
          "size": 8,
          "description": "Output Compare A"
        },
        {
          "name": "OCR0B",
          "address": "0x48",
          "size": 8,
          "description": "Output Compare B"
        }
      ]
    },
    "tc1": {
      "description": "Timer/Counter1 — 16-bit",
      "registers": [
        {
          "name": "TCCR1A",
          "address": "0x80",
          "size": 8,
          "description": "TC1 Control Register A",
          "fields": [
            {
              "name": "WGM10",
              "bit": 0,
              "access": "rw",
              "reset": 0,
              "description": "Waveform Generation Mode bit 0"
            },
            {
              "name": "WGM11",
              "bit": 1,
              "access": "rw",
              "reset": 0,
              "description": "Waveform Generation Mode bit 1"
            },
            {
              "name": "COM1B0",
              "bit": 4,
              "access": "rw",
              "reset": 0,
              "description": "Compare Output Mode B bit 0"
            },
            {
              "name": "COM1B1",
              "bit": 5,
              "access": "rw",
              "reset": 0,
              "description": "Compare Output Mode B bit 1"
            },
            {
              "name": "COM1A0",
              "bit": 6,
              "access": "rw",
              "reset": 0,
              "description": "Compare Output Mode A bit 0"
            },
            {
              "name": "COM1A1",
              "bit": 7,
              "access": "rw",
              "reset": 0,
              "description": "Compare Output Mode A bit 1"
            }
          ]
        },
        {